{
  "event_id": "evt_normal_sitting_001",
  "person_id": "elder_demo_001",
  "window": {
    "start": "2026-08-27T20:00:00+08:00",
    "end": "2026-08-27T20:10:00+08:00"
  },
  "observations": [
    {
      "type": "posture",
      "value": "sitting",
      "duration_sec": 600,
      "confidence": 0.96,
      "source": "mmwave"
    },
    {
      "type": "motion_level",
      "value": "normal",
      "confidence": 0.91,
      "source": "motion_sensor"
    }
  ],
  "context": {
    "room": "living_room",
    "time_period": "evening",
    "responded_to_voice_check": null,
    "voice_check_intent": null
  },
  "profile": {
    "mobility": "limited",
    "known_risks": ["previous_fall"],
    "normal_sitting_minutes": 45
  }
}


